Tag,Data
ATT&CK:T1078,"The Florida Department of Health has reported a data breach that may have comprised the personal information of some patients in Escambia, Santa Rosa, Okaloosa and Walton counties. The department completed an investigation and found that an unauthorized user compromised the Microsoft Outlook 365 account of an employee of the Children's Medical Services between Oct. 8 and Oct. 16, according to a news release. Upon discovery of the breach, the department immediately reset the affected employee's login credentials to terminate any inappropriate account access and promptly reported the event to the Inspector General and the Security Administration Team. Took immediate steps to remediate the breach and began an ongoing review of potentially impacted information;. Conducted a full review of department IT data to determine the circumstances of the breach;. Children's Medical Services is a collection of programs for children and families with special needs. People with questions on the data breach are urged to contact Children's Medical Services at 850-245-4201 and select option 3."
ATT&CK:T1326,"The attacker initially modified a DNS record for one particular server to point to a server in their possession and to intercept and forward the traffic to the original server that belongs to Fox-IT. This type of attack is called a Man-in-the-Middle attack. Sept 19 2017, 02:05-02:15 Maximum 10-minute time window during which the attacker temporarily rerouted and intercepted Fox-IT email for the specific purpose of proving that they owned our domain in the process of fraudulently registering an SSL certificate for our ClientPortal. Based on the outcome of our investigation, we understood the scope of the incident, we knew that the attack was fully countered and we were prepared to re-enable two factor authentication on ClientPortal in order to make it fully functional again. As mentioned, the attacker was able to redirect inbound traffic to ClientPortal and emails going to the fox-it.com domain for a short period of time. All our sensors do full packet capture and this is what allowed us to determine precisely, beyond any doubt, which information was intercepted by the attacker, the timeline of the event and who was affected by the attack. Once the attack was ongoing, we detected it reasonably quickly: within a few hours compared to the typical industry average of weeks before an attack is detected. We could, within a few hours of finding out about the attack, determine exactly who was affected and what the scope of the attacker was."
ATT&CK:T1078,"Gentoo Developers & Infrastructure escalated to GitHub support and the Gentoo Organization was frozen by GitHub staff. The Gentoo Proxy Maintainers Project was impacted as many proxy-maint contributors use GitHub to submit PRs. All past pull requests were apparently disconnected from their original commits and closed. The main Gentoo repositories are kept on Gentoo hosted infrastructure and Gentoo mirrors to GitHub in order to ""Be where the contributors are."" We do not believe the private keys of the account impacted were at risk, and so the gentoo-hosted infrastructure was not impacted by this incident. Action-item: review 2FA requirements for GitHub org Done: Gentoo GitHub Organization currently requires 2FA to join... action-item: reduce number of people with GitHub owner power. Revert of previous commit bf0e0a4d squashed with commit 50e3544d... 21:28 GitHub support responds; Gentoo GitHub org frozen. 22:45 GitHub locks suspected entry point GitHub does not disclose this to Gentoo, it's found in an audit log of the compromised user's account on 2018-06-29T14:30:18Z. 22:47 GitHub responds, assuring Gentoo that the audit is ongoing and logs will be produced soon. 11:46 GitHub responds and unlocks the Gentoo GitHub Organization, making it publicly visible once again,."
OWASP:A10,"Our site is operated for us by a third-party company, and it was the website provider's systems that experienced the intrusion. The attackers gained access to customer information, listed below, as transactions were made on the website provider's systems. Because you used your payment card information for online e-commerce web orders in the past, we are notifying you of this data breach. What Information Was Involved? The information that the attacker(s) had access to included debit/credit card number, expiration date and three digit credit card validation code. What Are We Doing? Our website provider has worked with a leading cybersecurity firm to identify and remove the malware from its systems and is actively monitoring the platform to safeguard personal information. We have secured our e-commerce credit card payment methodology by employing a third party hosted provider for communications and management of customer's personal information, including credit and debit card data. Hammernutrition.com is now 100% secure and safe to use for credit card transactions."
ATT&CK:T1078,"A small number of HSBC online banking customers - less than 1% of accounts - were breached last month by unauthorized users, the bank acknowledged Tuesday. ""We responded to this incident by fortifying our log-on and authentication processes, and implemented additional layers of security for digital and mobile access to all personal and business banking accounts. We have notified those customers whose accounts may have experienced unauthorized access, and are offering them one year of credit monitoring and identify theft protection service."" ""We are reminding our customers to protect access to their banking accounts by regularly changing their passwords, and by using unique passwords they are not using elsewhere, including on any social media accounts,"" Sherman said. When it detected the breach, HSBC suspended online access for affected accounts and required impacted customers to contact it. In 2015, HSBC notified mortgage customers of a data breach that had taken place the year before. Personal information about mortgage accounts was ""Inadvertently made accessible via the Internet,"" including customers' names, Social Security numbers, account numbers, old account information and possibly some phone numbers, the bank said at that time. Europe's General Data Protection Regulation requires companies to disclose personal data breaches to regulators and affected customers within 72 hours of becoming aware of them."
OWASP:A10,"Malware capable of secretly recording payment card details was removed today from the Infowars online store after ZDNet reached out to the company's staff. The malware works by recording payment card details entered inside store checkout forms and then sending the data to remote servers. De Groot spotted the malware infection on the Infowars online store using a powerful malware scanner that he built a few years back and which is specialized in detecting vulnerabilities and infections in online stores built on top of the Magento e-commerce platform. This piece of code -also referred to as a card skimmer, or skimmer- was present on all Infowars store pages, but it only activated during the checkout process. The report, summarized in this ZDNet piece, presented the tactics and histories of seven different cyber-criminal operations that have deployed Magecart-like card skimming malware on online stores in the past four years. Albeit the Dutch researcher shared technical details on how the Infowars store was infected with the card skimmer, ZDNet will refrain from publishing such information to avoid putting future Infowars customers at unnecessary risk. Just yesterday, de Groot published research revealing that one in five online stores that suffered a Magecart infection were reinfected, at least once."
ATT&CK:T1193,"Three high-ranking members of a sophisticated international cybercrime group operating out of Eastern Europe have been arrested and are currently in custody facing charges filed in U.S. District Court in Seattle, announced Assistant Attorney General Brian A. Benczkowski of the Justice Department's Criminal Division, U.S. Attorney Annette L. Hayes for the Western District of Washington and Special Agent in Charge Jay S. Tabb Jr. of the FBI Seattle Field Office. According to three federal indictments unsealed today, Ukrainian nationals Dmytro Fedorov, 44, Fedir Hladyr, 33, and Andrii Kolpakov, 30, are members of a prolific hacking group widely known as FIN7. Since at least 2015, FIN7 members engaged in a highly sophisticated malware campaign targeting more than 100 U.S. companies, predominantly in the restaurant, gaming, and hospitality industries. As set forth in indictments, FIN7 hacked into thousands of computer systems and stole millions of customer credit and debit card numbers, which the group used or sold for profit. In the United States alone, FIN7 successfully breached the computer networks of companies in 47 states and the District of Columbia, stealing more than 15 million customer card records from over 6,500 individual point-of-sale terminals at more than 3,600 separate business locations. Each of the three FIN7 conspirators is charged with 26 felony counts alleging conspiracy, wire fraud, computer hacking, access device fraud, and aggravated identity theft. Hladyr allegedly served as FIN7's systems administrator who, among other things, maintained servers and communication channels used by the organization and held a managerial role by delegating tasks and by providing instruction to other members of the scheme."
OWASP:A5,"Bob Diachenko, Hacken.io's director of cyber risk research, earlier this month found the company's MongoDB database on a server, wide open and without a password. The server contained 21,612 records and climbing - representing weeks' worth of data, Diachenko told TechCrunch, prior to blogging his findings. The data included donor email addresses and donation receipts, which included customized links to a donor's tax receipt. It took Kars4Kids two days to pull the database offline after Diachenko warned of the data exposure, he said. Diachenko said that Kars4Kids had told him that customers had been informed, but TechCrunch has found no evidence of the company's claim. A note left in the database by a hacker claimed to have ""Downloaded and backed up;"" the hacker demanded bitcoin in exchange for the data's safe return. The breach represents a portion - though not all - of the cars that Kars4Kids receives annually - reportedly tens of thousands each year."
OWASP:A10,"Kitronik says a recent data breach impacting online shoppers and involving the potential theft of their financial data is the work of Magecart. The company says that Magecart's payment card-skimming malware was operating on the Kitronik website over the period of August to September, as reported by the Register. Customers of the BBC micro:bit vendor and electronics kit seller may have been impacted by the breach. In an email to customers, Kitronik co-founder Geoff Hampson said that the firm believes ""Only details entered at the checkout stage that might have been taken and as a result, customers that had set up an account prior to August would not have had their address details stolen."" Kitronik has pointed the finger at Magecart for the data breach. Magecart has been connected to attacks which directly inject JavaScript into vulnerable e-commerce platforms in order to embed malware, as well as the compromise of payment systems through third-party applications and widgets. In October, a security researcher uncovered zero-day vulnerabilities in Magento extensions which are being actively abused by Magecart to spread payment-skimming malware."
ATT&CK:T1078,"On January 3, 2018, Mailgun became aware of an incident in which a customer's API key was compromised and immediately began diagnostics to help determine the cause and the scope of impact. Mailgun has now completed its diagnostic of accounts that were affected and has notified each of the affected users. If you were not directly notified by Mailgun regarding this incident, then your account was not affected. Finally, we'd like to assure our customers and partners that we take security at Mailgun very seriously. Only a small subset of Mailgun accounts were impacted. If you did not receive a notification email, your account was not among those affected. If you were notified that your account was affected, we advise that you do the following to protect your account from unauthorized access: 1) Rotate your Mailgun API keys 2) Change your SMTP username and passwords."
ATT&CK:T1193,SOURCE IS TOO SHORT
ATT&CK:T1078,THE PAGE COULD NOT BE FOUND
ATT&CK:T1078,"The Justice Department has indicted two Iranian men behind the SamSam ransomware attacks - that infected the cities of Atlanta, San Diego and Newark, N.J. - as well as two others who converted the ransom into Iranian riyals. Faramarz Shahi Savandi and Mohammad Mehdi Shah Mansouri, ""Extorted victims by leaving a ransom note in the form of a file on each computer encrypted by SamSam Ransomware,"" read the indictment, unsealed Wednesday a U.S. District Court in New Jersey. A SamSam attack crippled a number of systems and services in Atlanta in March and the Port of San Diego in September. The focus on healthcare may be due to the attacker's impression that these will be easier targets, they cybergang behind SamSam does show a preference for easy hits, or that they are more likely to fork over the ransom. Grammatical errors were a clue that the attackers likely didn't speak English as a first language, the attacks didn't rely on the typical badly worded spam email with an attachment. Once the attackers received the ransom, two Bitcoin exchangers, identified by the Treasury Department as Ali Khorashadizadeh and Mohammad Ghorbaniyan, turned it into Iranian riyals. ""Treasury is targeting digital currency exchangers who have enabled Iranian cyber actors to profit from extorting digital ransom payments from their victims. As Iran becomes increasingly isolated and desperate for access to U.S. dollars, it is vital that virtual currency exchanges, peer-to-peer exchangers, and other providers of digital currency services harden their networks against these illicit schemes,"" Treasury Under Secretary for Terrorism and Financial Intelligence Sigal Mandelker said in the release."
ATT&CK:T1193,"A summary obtained by Hard Fork details 14 different attacks on cryptocurrency exchanges since January last year and calculates the state-sponsored Lazarus group is responsible for $571 million of the ill-gotten gains. Group-IB expects the number of targeted attacks on cryptocurrency exchanges to rise, and not just the ones from Lazarus. It warns the most aggressive hacker groups, usually known for attacking banks, will shift their attention to cryptocurrency exchanges now they know just how lucrative it can be. Fraudsters are even building fake websites using stolen cryptocurrency project descriptions and plagiarized whitepapers, disappearing with investor funds shortly after launching a fake ICO. 51-percent attacks are increasing. Group-IB predict attacks on ICOs will remain a threat for almost every project looking to attract investors. For 51-percent attacks to be successful, bad actors must control a majority of the total computing power utilized by a Proof-of-Work powered blockchain. ""In 2017, no successful 51-percent attacks were detected, but they are now [happening] more often. In the first half of 2018, five successful attacks were registered with direct financial losses ranging from $0.55 million to $18 million,"" Group-IB reports."
BGP Hijack,"Between 11am until 1pm UTC today, DNS traffic - the phone book of the internet, routing you to your favourite websites - was hijacked by an unknown actor. The attackers used BGP - a key protocol used for routing internet traffic around the world - to reroute traffic to Amazon's Route 53 service, the largest commercial cloud provider who count major websites such as Twitter.com as customers. So far the only known website to have traffic redirected was to MyEtherWallet.com, a cryptocurrency website. The attacks only gained a relatively small amount of currency from MyEtherWallet.com - however their wallets in total already contained over £20m of currency. Mounting an attack of this scale requires access to BGP routers at major ISPs and real computing resource to deal with so much DNS traffic. The attackers failed to obtain an SSL certificate while man-in-the-middle attacking the traffic - a very easy process - which alerted people to the issue at scale. The security vulnerabilities in BGP and DNS are well known, and have been attacked before."
OWASP:A10,"Hackers injected 15 lines of card skimming code on the online retailer's payments page which remained for more than a month between August 14 and September 18, Yonathan Klijnsma, a threat researcher at RiskIQ, told TechCrunch. The code siphoned off credit card data from unsuspecting customers to a server controlled by the hackers with a similar domain name - likely to avoid detection. In an email to customers, Newegg chief executive Danny Lee said the company has ""Not yet determined which customer accounts may have been affected."" When reached, a Newegg spokesperson did not immediately comment. Klijnsma called the incident ""Another well-disguised attack"" that looked near-identical to the recent British Airways credit card breach, and earlier, the Ticketmaster breach. Like that breach, RiskIQ attributed the Newegg credit card theft to the Magecart group, a collective of hackers that carry out targeted attacks against vulnerable websites. ""The breach of Newegg shows the true extent of Magecart operators' reach,"" said Klijnsma. Anyone who entered their credit card data during the period should immediately contact their banks."
OWASP:A10,"Vermont's lobbyist registration and disclosure law applies to certain communications with and activities directed at the Attorney General. Prior to any interactions with the Office of the Vermont Attorney General, you are advised to review Title 2, Sections 261-268 of the Vermont Statutes Annotated, as well as the Vermont Secretary of State's most recent guide to compliance, available at https://www."
OWASP:A5,"Panerabread.com, the Web site for the American chain of bakery-cafe fast casual restaurants by the same name, leaked millions of customer records - including names, email and physical addresses, birthdays and the last four digits of the customer's credit card number - for at least eight months before it was yanked offline earlier today, KrebsOnSecurity has learned. The data available in plain text from Panera's site appeared to include records for any customer who has signed up for an account to order food online via panerabread.com. KrebsOnSecurity learned about the breach earlier today after being contacted by security researcher Dylan Houlihan, who said he initially notified Panera about customer data leaking from its Web site back on August 2, 2017. Some of the customer records include unique identifiers that increment by one for each new record, making it potentially simple for someone to scrape all available customer accounts. Another data point exposed in these records included the customer's Panera loyalty card number, which could potentially be abused by scammers to spend prepaid accounts or to otherwise siphon value from Panera customer loyalty accounts. It is not clear yet exactly how many Panera customer records may have been exposed by the company's leaky Web site, but incremental customer numbers indexed by the site suggest that number may be higher than seven million. Update, 8:40 p.m. ET: Almost minutes after this story was published, Panera gave a statement to Fox News downplaying the severity of this breach, stating that only 10,000 customer records were exposed."
ATT&CK:T1078,"TL;DR: A hacker broke into a few of Reddit's systems and managed to access some user data, including some current email addresses and a 2007 database backup containing old salted and hashed passwords. All Reddit data from 2007 and before including account credentials and email addresses What was accessed: A complete copy of an old database backup containing very early Reddit user data - from the site's launch in 2005 through May 2007. If you signed up for Reddit after 2007, you're clear here. Check your PMs and/or email inbox: we will be notifying you soon if you've been affected... Email digests sent by Reddit in June 2018 What was accessed: Logs containing the email digests we sent between June 3 and June 17, 2018. Took measures to guarantee that additional points of privileged access to Reddit's systems are more secure. If your account credentials were affected and there's a chance the credentials relate to the password you're currently using on Reddit, we'll make you reset your Reddit account password. If your email address was affected, think about whether there's anything on your Reddit account that you wouldn't want associated back to that address."
ATT&CK:T1078,"This notice is in regard to an incident at San Diego Unified School District involving the security of personal data on the district's information systems. How was it uncovered?The incident was uncovered by district Information Technology professionals investigating multiple reports of phishing emails, which were used to gather log-in information of staff members throughout the district. Who conducted the investigation?San Diego Unified Police and Information Technology staff. Selected staff benefits information, to include: health benefits enrollment information, beneficiary identify information, dependent identity information, savings or flexible spending account information;. Selected staff payroll and compensation information, to include: viewable paychecks and pay advices, deduction information, tax information, direct deposit financial institution name, routing number and account number, salary and leave information;. How many people were impacted?The data file contained information on students dating back to the 2008-09 school year, or more than 500,000 individuals. Has the problem been resolved?San Diego Unified Police and Information Technology staff have identified the methodology used to breach district data and notified all victims."
OWASP:A5,"As ElasticSearch based leaks become the latest source of massive data exposures, Sky Brasil, one of the biggest subscription television services in Brazil, is the latest to leave its customers exposed after not securing the server with a password. Independent researcher Fabio Castro found the firm exposed the data of 32 million subscribers in 28.7GB of log files and a 429.1GB of API data that revealed names, home addresses, phone numbers, birth dates, client IP address, payment methods, and encrypted passwords. ""The data the server stored was Full name, e-mail, password, pay-TV package data, client ip addresses, personal addresses, payment methods,"" Castro told BleepingComputer. NuData Security Vice President Ryan Wilk said the year has been a particularly bad year for news of the ""Non-breach 'breach'"" of sensitive user PII data. ""The unfortunate mishandling of trusted data by Sky Brasil, and before that Deep Root, data.gov.uk, and WWE continues to show that sophisticated hacking is not required to obtain troves of identity data that can be used to create fraudulent identities or access online personas,"" Wilk said. ""Understanding the user behind the device is key in effect devaluing the stolen identity data to any other person or entity,"" Wilk added. Earlier this week and ElasticSearch server exposed the data of nearly 57M U.S. residents and in another incident London-based Urban Massage app leaks data on 300K customers, including sexual misconduct claims."
ATT&CK:T1193,"Hackers used phishing emails to break into a Virginia bank in two separate cyber intrusions over an eight-month period, making off with more than $2.4 million total. The email allowed the intruders to install malware on the victim's PC and to compromise a second computer at the bank that had access to the STAR Network, a system run by financial industry giant First Data that the bank uses to handle debit card transactions for customers. Just eight months later - in January 2017 according to the lawsuit - hackers broke in to the bank's systems once more, again gaining access to the financial institution's systems via a phishing email. Prior to executing the second heist, the hackers used the bank's Navigator system to fraudulently credit more than $2 million to various National Bank accounts. Verizon also told the bank that the malware the attackers used to gain their initial foothold at the bank in the 2017 breach was embedded in a booby-trapped Microsoft Word document. ""In its Coverage Determination, Everest further determined that the 2016 Intrusion and the 2017 Intrusion were a single event, and thus, pursuant to the Debit Card Rider, National Bank's total coverage under the Bond was $50,000.00 for both intrusions,"" the bank said in its lawsuit. On July 20 it filed a response to the bank's claims, alleging that National Bank has not accurately characterized the terms of its coverage or fully explained the basis for Everest's coverage decision."
