Tag,Data
OWASP:A5,THE PAGE COULD NOT BE FOUND
ATT&CK:T1078,"A hacker has been able to send messages via text, email, and landline to tens of thousands of people across Australia after an emergency warning alert service, used by councils, was hacked. The message sent from the Early Warning Network on Friday night warned ""EWN has been hacked. Your personal data is not safe. Trying to fix the security issues"". EWN said a hacker accessed its alerting system and sent the message to part of its database. ""EWN staff at the time were able to quickly identify the attack and shut off our systems limiting the amount of messages sent out. Unfortunately, a small proportion of our database received this alert."" ""The actual data held in our system is just 'white pages' type data, we deliberately don't hold any other personal information."" The company said it's warning system remained fully operational during the breach and that it was working with the Queensland Police and the Australian Cyber Security Centre on the investigation. Mr Plowright said in the case of the NT, the EWN would usually be responsible for providing data to a number of ""Blue chip"" clients, including councils, regarding when and how a cyclone could hit."
ATT&CK:T1078,"The Indiana Department of Insurance is investigating a recent data breach suffered by Bankers Life and Casualty Co., a division of Carmel-based insurance holding company CNO Financial Group Inc. Bankers Life and Casualty Co. disclosed late last week that it was hit by a data breach between May 30 and Sept. 13, and the hackers were able to gain extensive personal information for a ""Limited group"" of customers. Chicago-based Bankers Life sells financial products to middle-income clients, including Medicare supplement insurance, supplemental health insurance, life insurance, long-term care insurance and annuities. Bankers Life declined to disclose to IBJ details of how the outsiders gained access to employee information, nor would it disclose the number of customers whose personal information was accessed. In a statement released late last week, Bankers Life said that ""Unauthorized third parties"" gained access to a limited number of Bankers Life employees' credentials between May 30 and Sept. 13. In addition to the group whose data was accessed, Bankers Life said, a larger group of its customers may have had their information exposed; including names, addresses, birth dates, the last four digits of Social Security numbers and insurance information such as policy numbers, types of insurance, premiums, dates of service and claims amounts. On Thursday, the company said, it notified certain customers about the issue, including people who hold Medicare supplement policies through Colonial Penn Life Insurance Co., another CNO Financial unit. The Indiana Department of Insurance said consumers concerned about cybersecurity can get more information here."
ATT&CK:T1078,"If you see anything you do not understand on your credit report, call the credit agency immediately. If you find any suspicious activity on your statements or credit reports, call your local police or sheriff's office, file a police report for identity theft and get a copy of it. You may obtain a copy of your credit report, free of charge, once every 12 months from each of the three nationwide credit reporting companies. If you find anything suspicious, call the credit reporting agency at the phone number on the report. To place a security freeze on your credit report, you may be able to use an online process, an automated telephone line, or a written request to any of the three credit reporting agencies listed above. The fee is waived if you are a victim of identity theft and have submitted a valid investigative or law enforcement report or complaint relating to the identity theft incident to the credit reporting agencies. Reporting of identity theft and obtaining a police report."
OWASP:A10,"If you find any suspicious activity on your credit reports, call your local police or sheriff's office, and file a police report for identity theft and get a copy of it. Sincerely, Tamara Pattison Chief Marketing and Information Officer Information About Identity Theft Protection Review of Accounts and Credit Reports: You can regularly review statements from your accounts and periodically obtain your credit report from one or more of the national credit reporting companies. You should remain vigilant with respect to reviewing your account statements and credit reports, and you should promptly report any suspicious activity or suspected identity theft to the proper law enforcement authorities, including local law enforcement, your state's attorney general, and/or the Federal Trade Commission. You should be aware that using a security freeze to take control over who gets access to the personal and financial information in your credit report may delay, interfere with, or prohibit the timely approval of any subsequent request or application you make regarding a new loan, credit, mortgage, or any other account involving the extension of credit. Upon seeing a fraud alert display on a consumer's credit file, a business is required to take steps to verify the consumer's identity before extending new credit. You can place a fraud alert on your credit report by contacting any of the three national credit reporting agencies at the addresses or toll-free numbers listed at the bottom of this page. You can obtain more information about fraud alerts and credit freezes by contacting the FTC or one of the national credit reporting agencies listed below."
ATT&CK:T1326,"Unknown hackers have hijacked the DNS server for BlackWallet. The attack happened late Saturday afternoon, January 13, when the attackers hijacked the DNS entry of the BlackWallet. ""The DNS hijack of Blackwallet injected code,"" said Kevin Beaumont, a security researcher who analyzed the code before the BlackWallet team regained access over their domain and took down the site. The BlackWallet team and other XLM owners have tried to warn users via alerts on Reddit, Twitter, GitHub, the Stellar Community and GalacticTalk forums, but to no avail, as users continued to log into the rogue BlackWallet. BlackWallet admins are now desperately trying to catch Bittrex's attention to block the hackers' account. According to the BlackWallet admin, the incident took place after someone accessed his hosting provider account. ""Please note however that blackwallet was only an account viewer and that no keys were stored on the server!""."
OWASP:A5,"Blind said that the exposure only affects users who signed up or logged in between November 1 and December 19, and that the exposure relates to ""a single server, one among many servers on our platform,"" according to Blind executive Kyum Kim in an email. Blind only pulled the database after TechCrunch followed up by email a week later. The database also revealed the unencrypted private messages between members, but not the associated email addresses of each user. Blind claims on its website that its email verification ""Is safe, as our patented infrastructure is set up so that all user account and activity information is completely disconnected from the email verification process."" It adds: ""This effectively means there is no way to trace back your activity on Blind to an email address, because even we can't do it."" Blind claims that the database ""Does not show any mapping of email addresses to nicknames,"" but we found did find streams of email addresses associated with members who had not yet posted. When other records didn't store an email address, the record contained the user's email as an unrecognized encrypted hash - which may be decipherable to Blind employees, but not to anyone else. Despite the company's apparent efforts to disassociate email addresses from its platform, login records in the database also stored user account access tokens - the same kind of tokens that recently put Microsoft and Facebook accounts at risk. Some users sent anonymous, private messages in some cases made serious allegations against their colleagues or their managers, while others expressed concern that their employers were monitoring their emails for Blind sign-up emails."
OWASP:A5,"On Thursday, December 13th 2018, we became aware that some information about Blur users had been potentially exposed and immediately began working to ensure our systems and data were secure, to determine what happened, and to inform and help our users. Each user's last and second-to-last IP addresses used to login to Blur.Each user's encrypted Blur password. As a best practice, you should change your Blur password. If you use the same password you use on Blur on any other service, you should change those passwords to new unique passwords as well. To change your password, click ""Edit"" next to your password in your Blur Settings. You should also take this opportunity to ensure your new Blur password is long, but something you can remember, and that you have your Blur backup passphrase as well. You should use multi-factor authentication for your Blur account to add an extra layer of security to your account."
OWASP:A10,THE PAGE IS IN AN UNRECOGNISABLE FORMAT
OWASP:A10,"Logo ... How Bulletproof Coffee markets itself on its website. Bulletproof 360 Inc., purveyors of the fatty coffee touted as a wonder-treatment for mental clarity and weight loss, admitted that from May 20 to October 19 of this year - minus one day on October 14 - hackers slurped sensitive personal information hipsters entered when purchasing stuff online. ""In mid-October 2017, Bulletproof identified unauthorized computer code that had been added to the software that operates the checkout page at www.bulletproof.com,"" Bulletproof said in its mea culpa notification letter [PDF] to customers. Bulletproof said it is ""Working diligently"" to shore up its web systems after its security went to pot, and has vowed to prevent future similar attacks. As is usually the case with these sort of cockups, Bulletproof is advising its caffeine addicts to keep a close eye on their bank statements for any unauthorized charges brewing. The network security breach is particularly grinding for Bulletproof given its tech pedigree and the firm's particular appeal in Silicon Valley. Bulletproof got into the public spotlight on the back of endorsements from VC and startup execs in the tech world."
ATT&CK:T1078,"According to a letter of warning sent out recently the Orange County, Calif., branch of the Girl Scouts experienced a data breach. The data breach, which is estimated to affect almost 3,000 members, occurred over the course of one day toward the end of September. An unknown third-party attacker was able to gain access to the email , which then allowed them to send numerous emails to various strategic locations. The data contained within these records include full legal birth names, home addresses, driver's license numbers, health history, and even insurance policy numbers. In the aftermath of the breach, the Girl Scouts of Orange County notified the attorney general in California of the incident. The letter also stated that the Girl Scouts went through their emails and deleted any that contained personal data. Finally, Christina Salcido stated that the Girl Scouts are beefing up their security by ""Implementing a secure online system for Troop Travel forms,"" as well as other undisclosed security hardening efforts being developed with their IT team."
OWASP:A9,"Britain's data privacy watchdog has imposed one of its largest fines ever against retailer Carphone Warehouse over a massive data breach it suffered in 2015. The data breach of Carphone Warehouse affected its online division, which operates the OneStopPhoneShop.com, e2save.com and Mobiles.co.uk websites, and resulted in unauthorized access to the personal data of 3.3 million customers and 1,000 employees. ""A company as large, well-resourced and established as Carphone Warehouse should have been actively assessing its data security systems, and ensuring systems were robust and not vulnerable to such attacks,"" U.K. Information Commissioner Elizabeth Denham says. Because the ICO offers a 20 percent discount on fines that are paid within one month, it's expected that Carphone Warehouse will ultimately pay &pound320,000. While the ICO's breach report says there was ""No single root cause"" of the attack, it appeared to involve compromising a vulnerable WordPress installation that ""Was considerably out-of-date, exposed to the internet and suffered from multiple vulnerabilities."" Via WordPress, the attacker uploaded web shells that gave them file management and database access rights, the ICO says, at which point the attacker recovered credentials being stored in plaintext that led to the attacker accessing the databases that exposed customer data. The size of the fine against Carphone Warehouse equals the ICO's record fine for London-based telecommunications giant TalkTalk in October 2015. The Carphone Warehouse penalty comes just months before the EU begins enforcing its General Data Protection Regulation on May 25, 2018."
OWASP:A10,"Vermont's lobbyist registration and disclosure law applies to certain communications with and activities directed at the Attorney General. Prior to any interactions with the Office of the Vermont Attorney General, you are advised to review Title 2, Sections 261-268 of the Vermont Statutes Annotated, as well as the Vermont Secretary of State's most recent guide to compliance, available at https://www."
ATT&CK:T1193,THE PAGE IS IN AN UNRECOGNISABLE FORMAT
ATT&CK:T1193,"Three high-ranking members of a sophisticated international cybercrime group operating out of Eastern Europe have been arrested and are currently in custody facing charges filed in U.S. District Court in Seattle, announced Assistant Attorney General Brian A. Benczkowski of the Justice Department's Criminal Division, U.S. Attorney Annette L. Hayes for the Western District of Washington and Special Agent in Charge Jay S. Tabb Jr. of the FBI Seattle Field Office. According to three federal indictments unsealed today, Ukrainian nationals Dmytro Fedorov, 44, Fedir Hladyr, 33, and Andrii Kolpakov, 30, are members of a prolific hacking group widely known as FIN7. Since at least 2015, FIN7 members engaged in a highly sophisticated malware campaign targeting more than 100 U.S. companies, predominantly in the restaurant, gaming, and hospitality industries. As set forth in indictments, FIN7 hacked into thousands of computer systems and stole millions of customer credit and debit card numbers, which the group used or sold for profit. In the United States alone, FIN7 successfully breached the computer networks of companies in 47 states and the District of Columbia, stealing more than 15 million customer card records from over 6,500 individual point-of-sale terminals at more than 3,600 separate business locations. Each of the three FIN7 conspirators is charged with 26 felony counts alleging conspiracy, wire fraud, computer hacking, access device fraud, and aggravated identity theft. Hladyr allegedly served as FIN7's systems administrator who, among other things, maintained servers and communication channels used by the organization and held a managerial role by delegating tasks and by providing instruction to other members of the scheme."
ATT&CK:T1193,"Three high-ranking members of a sophisticated international cybercrime group operating out of Eastern Europe have been arrested and are currently in custody facing charges filed in U.S. District Court in Seattle, announced Assistant Attorney General Brian A. Benczkowski of the Justice Department's Criminal Division, U.S. Attorney Annette L. Hayes for the Western District of Washington and Special Agent in Charge Jay S. Tabb Jr. of the FBI Seattle Field Office. According to three federal indictments unsealed today, Ukrainian nationals Dmytro Fedorov, 44, Fedir Hladyr, 33, and Andrii Kolpakov, 30, are members of a prolific hacking group widely known as FIN7. Since at least 2015, FIN7 members engaged in a highly sophisticated malware campaign targeting more than 100 U.S. companies, predominantly in the restaurant, gaming, and hospitality industries. As set forth in indictments, FIN7 hacked into thousands of computer systems and stole millions of customer credit and debit card numbers, which the group used or sold for profit. In the United States alone, FIN7 successfully breached the computer networks of companies in 47 states and the District of Columbia, stealing more than 15 million customer card records from over 6,500 individual point-of-sale terminals at more than 3,600 separate business locations. Each of the three FIN7 conspirators is charged with 26 felony counts alleging conspiracy, wire fraud, computer hacking, access device fraud, and aggravated identity theft. Hladyr allegedly served as FIN7's systems administrator who, among other things, maintained servers and communication channels used by the organization and held a managerial role by delegating tasks and by providing instruction to other members of the scheme."
ATT&CK:T1193,"Three high-ranking members of a sophisticated international cybercrime group operating out of Eastern Europe have been arrested and are currently in custody facing charges filed in U.S. District Court in Seattle, announced Assistant Attorney General Brian A. Benczkowski of the Justice Department's Criminal Division, U.S. Attorney Annette L. Hayes for the Western District of Washington and Special Agent in Charge Jay S. Tabb Jr. of the FBI Seattle Field Office. According to three federal indictments unsealed today, Ukrainian nationals Dmytro Fedorov, 44, Fedir Hladyr, 33, and Andrii Kolpakov, 30, are members of a prolific hacking group widely known as FIN7. Since at least 2015, FIN7 members engaged in a highly sophisticated malware campaign targeting more than 100 U.S. companies, predominantly in the restaurant, gaming, and hospitality industries. As set forth in indictments, FIN7 hacked into thousands of computer systems and stole millions of customer credit and debit card numbers, which the group used or sold for profit. In the United States alone, FIN7 successfully breached the computer networks of companies in 47 states and the District of Columbia, stealing more than 15 million customer card records from over 6,500 individual point-of-sale terminals at more than 3,600 separate business locations. Each of the three FIN7 conspirators is charged with 26 felony counts alleging conspiracy, wire fraud, computer hacking, access device fraud, and aggravated identity theft. Hladyr allegedly served as FIN7's systems administrator who, among other things, maintained servers and communication channels used by the organization and held a managerial role by delegating tasks and by providing instruction to other members of the scheme."
OWASP:A10,"Vermont's lobbyist registration and disclosure law applies to certain communications with and activities directed at the Attorney General. Prior to any interactions with the Office of the Vermont Attorney General, you are advised to review Title 2, Sections 261-268 of the Vermont Statutes Annotated, as well as the Vermont Secretary of State's most recent guide to compliance, available at https://www."
ATT&CK:T1078,"A data breach impacting employees of East Tennessee State University is still under investigation, CBS affiliate WJHL reports. University officials said that two employees clicked on a link in the phishing scam that was sent to their e-mail accounts. ETSU has been investigating and working to identify which staff members were affected and what information may have been exposed. Private information of 7,700 people could be exposed. ""On October 17, 2018 ETSU ITS discovered that an ETSU employee clicked on a phishing email that resulted in an unauthorized person accessing here email mailbox. Immediately upon discovery, ETSU ITS disabled the employee's email access , reset the employee's username and password and commenced an investigation...We are notifying you, because personal information about you and/or individuals in your family, household or otherwise, was contained in one of the employee's email mailbox."" ""The types of information present in the email mailboxes include full name and security numbers of each individual listed below: Other information that may have been included is noted next to the individual's name."""
ATT&CK:T1193,"The hacker setup a whole bunch of malicious servers. If someone's Electrum Wallet connected to one of those servers, and tried to send a BTC transaction, they would see an official-looking message telling them to update their Electrum Wallet, along with a scam URL. The hacker has already stolen 200 BTC, at this one address. ADVICE: Ignore any ""Update"" notifications in Electrum. I'm not 100% certain, but if you never downloaded the ""Update"", your wallet & funds should be ok. As for usage, I'd personally avoid using Electrum wallet for a few days, until the devs figure everything out."
OWASP:A9,"USATODAY.A timeline of the massive Equifax breach, which affected as many as 145.5 million U.S. consumers. Sept. 7.Breach publicly announced. Sept. 8.Equifax shares plunge 13.7% in first day of trading after breach announced. Sept. 12.Equifax announces two senior computer security executives at the company are retiring. Sept. 11.Sen. Orrin Hatch, R-Utah, who chairs the Senate Committee on Finance, and Sen. Ron Wyden, D-Oregon, the panel's ranking minority member, ask the credit-reporting giant for a timeline of the breach, along with details of Equifax's efforts to quantify the scope of the intrusion and limit consumer harm. Sept. 15.Equifax announces its chief information officer, Susan Mauldin, and chief security officer, David Webb are retiring ""Effective immediately."" Sept. 21.Equifax admits it sent victims of the data breach to a bogus website that shared a similar address to the one it set up to help victims."
OWASP:A5,"You've probably never heard of the marketing and data aggregation firm Exactis. Earlier this month, security researcher Vinny Troia discovered that Exactis, a data broker based in Palm Coast, Florida, had exposed a database that contained close to 340 million individual records on a publicly accessible server. The haul comprises close to 2 terabytes of data that appears to include personal information on hundreds of millions of American adults, as well as millions of businesses. While the precise number of individuals included in the data isn't clear-and the leak doesn't seem to contain credit card information or Social Security numbers-it does go into minute detail for each individual listed, including phone numbers, home addresses, email addresses, and other highly personal characteristics for every name. Exactis did not respond to multiple calls and emails from WIRED asking for comment on its data leak. Aside from the sheer breadth of the Exactis leak, it may be even more remarkable for its depth: Each record contains entries that go far beyond contact information and public records to include more than 400 variables on a vast range of specific characteristics: whether the person smokes, their religion, whether they have dogs or cats, and interests as varied as scuba diving and plus-size apparel. While the lack of financial information or Social Security numbers means the database isn't a straightforward tool for identity theft, the depth of personal info nonetheless could help scammers with other forms of social engineering, says Marc Rotenberg, executive director of the nonprofit Electronic Privacy Information Center."
ATT&CK:T1078,"Vermont's lobbyist registration and disclosure law applies to certain communications with and activities directed at the Attorney General. Prior to any interactions with the Office of the Vermont Attorney General, you are advised to review Title 2, Sections 261-268 of the Vermont Statutes Annotated, as well as the Vermont Secretary of State's most recent guide to compliance, available at https://www."
OWASP:A6,THE PAGE IS IN AN UNRECOGNISABLE FORMAT
OWASP:A5,"FedEx has exposed private information belonging to thousands of its customers after a legacy server was left open without a password. The data, hosted on a password-less Amazon S3 storage server, was secured Tuesday after efforts were made to contact FedEx. It's those unencrypted private customer records that were exposed on the server. The server contained more than 112,000 files, a mix of the completed US Postal Service forms used to authorize the handling of mail, along with identification. Among the exposed files, ZDNet confirmed drivers' licenses, national ID cards, and work ID cards, voting cards, and utility bills. We reached out to several individuals whose data was exposed by the password-less server, who confirmed their details and that they were either FedEx or Bongo customers. The server was secured within a few hours of ZDNet contacting FedEx."
ATT&CK:T1078,"Vermont's lobbyist registration and disclosure law applies to certain communications with and activities directed at the Attorney General. Prior to any interactions with the Office of the Vermont Attorney General, you are advised to review Title 2, Sections 261-268 of the Vermont Statutes Annotated, as well as the Vermont Secretary of State's most recent guide to compliance, available at https://www."
