Tag,Data
OWASP:A5,"India's largest bank, the State Bank of India, has leaked the financial data of millions of its customers, according to a TechCrunch report. The bank, according to TechCrunch on Wednesday, left a server with the banking data of its customers unprotected. The reported server made sensitive data accessible for anyone to view, but the issue appears to have been fixed. The unprotected server was discovered at one of its data centres in Mumbai by a security researcher, who preferred to remain anonymous. The server, which stored two months of financial data from SBI Quick, is a text message and call-based system that allows customers to review their recent transactions, balances, and credit information. Just days earlier, SBI had accused Aadhaar's authority, Unique Identification Authority of India, of mishandling citizen data that allowed fake Aadhaar identity cards to be created. ""Speaking about this particular leak, I think virtually any large financial organisations may face a similar incident. Modern IT infrastructures are so complicated that virtually no single company has an up2date and holistic inventory of their digital assets, let alone continuous monitoring and related security processes. While data sharing with trusted third-parties makes privacy and data protection virtually impossible."""
OWASP:A5,"På en öppen webbserver, helt utan lösenordsskydd eller annan säkerhet, har vi hittat 2,7 miljoner inspelade samtal till rådgivningsnumret 1177. Samtalen sträcker sig tillbaka till 2013 och det handlar om 170 000 timmar av känsliga samtal som vem som helst har kunnat ladda ner eller lyssna på. Computer Sweden har lyssnat på några av samtalen för att bilda oss en uppfattning om omfattningen av läckan och skadan för allmänheten. Det är även helt klart frågan om information som räknas som känsliga personuppgifter enligt GDPR. När en person vill få rådgivning via 1177 Vårdguiden per telefon, kopplas samtalen till antingen till vårdregionens egna anställda sjuksköterskor, vilket sker i de flesta vårdregioner, eller så kopplas till de företag som är entreprenörer åt de sjukvårdsregioner som låter entreprenörer ta hand om rådgivningen. Medicall är en underleverantör till vårdentreprenören Medhelp som tar emot patientsamtal via 1177 Vårdguiden från vårdregionerna i Stockholm, Södermanland och Värmland. Som ett resultat av vår granskning är åtkomsten till lagringsenheten nu stängd, men Computer Sweden har under granskningen kunnat komma åt samtliga samtal, i form av mp3- eller wav-filer, ända tillbaka till 2013, och i princip i realtid för de senaste samtalen. ""1177 Vårdguiden på telefon svarar på hälso- och vårdfrågor från allmänheten. Varje region ansvarar för driften av tjänsten 1177 Vårdguiden på telefon och Inera ansvarar för samordning, medicinska beslutsunderlag och varumärket. För 18 av de 21 regionerna levererar Inera även telefoni- och journalsystem."" Samtalen till 1177 Vårdguiden på telefon spelas in för att ha möjlighet att gå tillbaka och kvalitetssäkra samtalen."
OWASP:A10,"Update: Hardware wallet Ledger's CEO Eric Larchevêque comments, ""The Coinomi meltdown is further evidence of why software wallets are a recipe for disaster. When entrusting a software wallet with your assets, you are exposing your private keys to the internet, leaving them vulnerable to attack."" Coinomi has responded to the allegations in this post on Medium which states the spell checking functionality was enabled for desktop wallets but that the seed phrase wasn't sent as plain text, it was ""Encapsulated inside a HTTPS request with Google being the sole recipient."" It added that Google did not process, cache or store the requests. A report by security consultant Warith Al Maawali claims he lost $60,000 to $70,000 while using the Coinomi wallet. Al Maawali told Decrypt he used his Ethereum seed phrase in the Coinomi wallet to access Ethereum-based tokens that he owned but were not supported by the Exodus crypto wallet which he was already using. Due to this, he did some research and found what he believes is a critical vulnerability within the Coinomi wallet. There have been other reports of funds disappearing on the Coinomi wallet-which isn't uncommon for any software wallet. There are two posts on Reddit by users who claim their funds have disappeared from the Coinomi wallet."
ATT&CK:T1078,"An unauthorized person was able to gain access to a TransUnion Canada web portal and use it to pull consumer credit files. BleepingComputer has learned that starting last week TransUnion Canada began sending out data security incident notifications via postal mail to consumers whose information was accessed via an unauthorized login. These notifications state that an unauthorized user utilized a TransUnion business portal to perform credit file lookups between June 28th and July 11th, 2019. ""Trans Union of Canada, Inc is writing to let you know about a data security incident. Our customer, CWB National Leasing Inc.'s, has advised us that their access code to TransUnion systems may have been misappropriated and used to access information about you without authorization. Upon becoming aware of the incident, TransUnion commenced an investigation."" ""By way of background, TransUnion operates a portal through which our business customers can retrieve consumer credit files for permitted purposes. An unidentified person illegal obtained CWB National Leasing's access code and password to the portal, which has permitted access to some of TransUnion's credit file information between approximately June 28 and July 11, 2019. TransUnion has confirmed that the login credentials were terminated."" ""TransUnion continues to look for ways to further strengthen our defenses against unauthorized access of any kind to TransUnion data. Affected consumers should also take advantage of the two years of free credit and fraud monitoring services being offered by TransUnion as part of this security incident."
OWASP:A5,"The United Nations' children's agency UNICEF has leaked thousands of individuals' personal data through its online learning portal Agora. Agora offers courses on child rights, humanitarian action, data, research and is used by UNICEF staff and members of the public. UNICEF became aware fi the incident a day after the email was sent and remedied the situation to ""Prevent such an incident from reoccurring"". Agora users were sent an email explaining the situation which then asked them to delete the spreadsheet full of data they may have received from their inboxes and their recycle bins too. Whether UNICEF will be subject to a GDPR investigation is undetermined as of yet, with some experts thinking that UNICEF may avoid one as it's a United Nations organisation. Clare Sullivan, managing director of CyberSMART told Devex that UNICEF will probably be exempt from a GDPR probe as a UN body but it's something that still hasn't been tested in court. Mekki took a more absolute approach when addressing the question and said: ""UN entities are not subject to GDPR"" and that UNICEF did not report the case to authorities."
OWASP:A5,"A Wisconsin mattress company leaked the records of 387,000 customers online in a database that lacked password protection, a security researcher has found. The incident once again demonstrates the potential security consequences of failing to take even the simplest security measures to protect company data. Further investigation found that every file contained references to Verlo Mattress Factory and ""Appeared to be customer data,"" he said in a blog post about the incident on Thursday. The database set-which contains 387,604 records with names, phone numbers, emails, home addresses and billing addresses-was open and visible in any browser for anyone to edit, download or even delete data without administrative credentials, according to Fowler. Data found in the files also included login credentials with hashed passwords for internal users as well as IP addresses, ports, pathways and storage info that could allow potential cybercriminals deeper access to other network resources, he said. The latter was the case earlier this month, when cosmetics giant Yves Rocher exposed the personal data of millions of its customers and reams of sensitive internal company information to the public because of an online server left unprotected by a third-party consultant to the firm. ""In today's world, it is not if a data breach will happen, it is a matter of when the data breach will happen,"" he wrote."
OWASP:A10,"Trend Micro researchers reported that a Magecart group has hacked the websites of two hotel chains to inject scripts targeting Android and iOS users. Researchers discovered a series of incidents involving software credit card skimmer used by Magecart to hit the booking websites of hotel chains. In early September, the researchers discovered a JavaScript code onto two hotel websites belonging to different hotel chains. ""The downloaded script for mobile devices is a credit card skimmer which can steal the information entered on the hotel booking page and send it to a remote server."" Experts noticed that the link would deliver a credit card skimmer script only when users visited the websites using mobile devices, suggesting that the attackers aimed at targeting only mobile users. Although the module was only used for two websites of two different hotel chains, the number of potential victims is very high, as one of these brands has 107 hotels in 14 countries, while the other has 73 hotels in 14 countries. The software skimmer replaces the original credit card form on the booking page, in this way attackers could require customers to submit all credit card data, including the CVC number that is not required in some booking pages."
OWASP:A5,"Researchers at Greenbone Networks vulnerability analysis and management company discovered 400 Million medical radiological images exposed online via unsecured PACS servers. The experts at Greenbone Networks vulnerability analysis and management company discovered 600 unprotected servers exposed online that contained medical radiological images. PACS servers are used in the healthcare industry to archive images created by radiological processes and to make them available to medical staff for analysis and diagnosis. ""There are more than 737 million images linked to this patient data, around 400 million of which are accessible or can be easily downloaded from the internet. In addition, there are 39 systems that allow access to patient data via an unencrypted HTTP Web Viewer, without any protection."" The researchers used a RadiAnt DICOM Viewer to analyze data from open PACS servers exposed online, they were able to download and view 399.5 million images out of 733.5. Giving a look at the geographic distribution of the PACS servers that were leaking the images, most of unprotected PACS servers is in North America is in the U.S. ""In the US, the number is orders of magnitude higher with 13.7 million data sets and 45.8 million images freely accessible on the internet."" continues the report. In South America, most of the exposed images were stored on PACS servers in Brazil, in the country the experts found 640,000 data sets, and 31.1 million images."
OWASP:A5,"The breach, which reportedly exposed data on millions of passengers, is one of many that have resulted from organizations leaving data publicly accessible in cloud storage buckets. A breach that reportedly exposed data on millions of passengers of two Lion Air airline subsidiaries is another example of the massive exposure that organizations face from leaving data in poorly secured cloud storage. The data belonged to passengers of Malindo Air and Thai Lion Air. A Dark Web operator known as Spectre later dumped four files - two containing data from Malindo and two with data on Thai Lion Air - online, South China Morning Post reported this week. ""Our in house teams along with external data service providers, Amazon Web Services and GoQuo, our e-commerce partner, are currently investigating into this breach,"" Malindo Air said. In June, Australian cybersecurity vendor UpGuard reported on data integration firm Attunity's exposing a terabyte's worth of backups belonging to companies including Ford, Netflix, and TD Bank by putting the data in three publicly accessible S3 buckets. According to UpGuard, organizations can lock down ACLs to an Amazon S3 bucket but still leave data wide open by misconfiguring the bucket policy itself."
OWASP:A5,"Exclusive Tesco has shuttered its parking validation web app after The Register uncovered tens of millions of unsecured ANPR images sitting in a Microsoft Azure blob. The images consisted of photos of cars taken as they entered and left 19 Tesco car parks spread across Britain. Tesco admitted to The Register that ""Tens of millions"" of timestamped images were stored on it, adding that the images had been left exposed after a data migration exercise. Tesco customers across the nation were instructed to use parkshopreg.co.uk to validate their parking with a code printed on their receipts along with their vehicle's registration number, thus avoiding parking charges. Live ANPR images were saved to the blob as timestamped jpegs with the time information also contained within the image filenames, allowing anyone with access to harvest the images in bulk for illicit use. The web app compared the store-generated code with the ANPR images to decide whom to issue with parking charges. A Tesco spokesman told The Register: ""A technical issue with a parking app meant that for a short period historic images and times of cars entering and exiting our car parks were accessible. Whilst no images of people, nor any sensitive data were available, any security breach is unacceptable and we have now disabled the app as we work with our service provider to ensure it doesn't happen again."""
ATT&CK:T1078,"The online education platform for developers Thinkful suffered a security breach and is notifying the incident to its customers requiring them to reset their passwords. The online education platform for developers Thinkful has suffered a data breach, just a few days after it has announced it would be acquired by the education tech firm Chegg for $80 million. The company is notifying the incident to its users via email and is forcing a password reset in response to the incident. ""We recently discovered that an unauthorized party may have gained access to certain Thinkful company credentials so, out of an abundance of caution, we are notifying all of our users."" reads the data breach notification sent by the company. Thinkful attempted to downplay the incident declaring that there is ""No evidence"" of any unauthorized access to users' account data. ""Additionally, at this time we have no evidence of any unauthorized access to any other Thinkful user account data or user information. However, as a measure of added precaution, we are requiring all users to reset their Thinkful passwords."" continues the notification. Curiously, one year ago Chegg alsodisclosed a data breach that obliged the company to reset the passwords of its 40 million users."
OWASP:A6,"A hacker broke into thousands of accounts belonging to users of two GPS tracker apps, giving him the ability to monitor the locations of tens of thousands of vehicles and even turn off the engines for some of them while they were in motion, Motherboard has learned. The hacker, who goes by the name L&M, told Motherboard he hacked into more than 7,000 iTrack accounts and more than 20,000 ProTrack accounts, two apps that companies use to monitor and manage fleets of vehicles through GPS tracking devices. On some cars, the software has the capability of remotely turning off the engines of vehicles that are stopped or are traveling 12 miles per hour or slower, according to the manufacturer of certain GPS tracking devices. According to a sample of user data L&M shared with Motherboard, the hacker has scraped a treasure trove of information from ProTrack and iTrack customers, including: name and model of the GPS tracking devices they use, the devices' unique ID numbers; usernames, real names, phone numbers, email addresses, and physical addresses. A screenshot of the hacked account of a user, provided to Motherboard by the hacker. Though the hacker didn't prove that he was able to turn off a car's engine, a representative for Concox, the makers of one of the hardware GPS tracking devices used by some of the users of ProTrack GPS and iTrack, confirmed to Motherboard that customers can turn off the engines remotely if the vehicles are going under 20 kilometers per hour. The apps have a feature to ""Stop engine,"" according to a screenshot provided by the hacker."
OWASP:A6,"A misconfigured and publicly accessible ElasticSearch cluster owned by FMC Consulting, a Chinese headhunting company, leaked millions of resumes and company records, as well as customers and employees PII data. The database containing hundreds of thousands of customer records, internal emails, as well as employees daily tasks and calls they made while contacting clients was left unprotected, exposing all the data to anyone who knew where and how to look for it. 9082 company contracts 884,178 mail logs with complete email body 5,392,816 company records 20,539,522 resumes 110,000 customer records 73,000 client messages Full records of employees daily tasks Full records of calls made from the office. May 20 - Sanyam Jain discovers the exposed ElasticSearch clusterMay 20 - Researcher contacts FMC Consulting and CNCERT/CCMay 23 - BleepingComputer also reaches out to CNCERT/CCMay 23 - Researcher contacts more FMC Consulting employeesMay 29 - No response from the company or employeesMay 30 - CNCERT/CC responds saying that it will take care of the incident. Since the beginning of 2019, unprotected and publicly available ElasticSearch clusters leaked over 108 million bets from various online casinos exposing their bettors' PII data, roughly 33 million profiles of Chinese people looking for jobs, and hundreds of thousands of sensitive legal documents ""Not designated for publication."" Over 114 million records of US companies and citizens and more than 32 million records of SKY Brasil customers were also impacted by data leaks caused by misconfigured ElasticSearch databases during November 2018. Elastic advises admins to set passwords for their servers' built-in users, to secure the ElasticSearch stack by ""Encrypting communications, role-based access control, IP filtering, and auditing,"" and to correctly configure the ElasticSearch cluster prior to deploying it in production."
OWASP:A6,"New York regulators are investigating a weakness that exposed 885 million mortgage records at First American Financial Corp. [NYSE:FAF] as the first test of the state's strict new cybersecurity regulation. On May 24, KrebsOnSecurity broke the news that First American had just fixed a weakness in its Web site that exposed approximately 885 million documents - many of them with Social Security and bank account numbers - going back at least 16 years. On May 29, The New York Times reported that the inquiry by New York's Department of Financial Services is likely to be followed by other investigations from regulators and law enforcement. First American says it has hired a third-party security firm to investigate, and that it shut down external access to the records. The Times says few people outside the real estate industry are familiar with First American, but millions have entrusted their data to the company when they go to close the deal on buying or selling a new home. ""First American provides title insurance and settlement services for property sales, which typically require buyers to hand over extensive financial records to other parties in their transactions,"" wrote Stacy Cowley. News also emerged this week that First American is now the target of a class action lawsuit alleging the Fortune 500 mortgage industry giant ""Failed to implement even rudimentary security measures."""
OWASP:A6,"A Florida-based ad agency has left a database open on the internet that leaked details about past advertising campaigns, including information regarding medical malpractice cases, and sensitive details about combat injuries sustained by US military veterans. The database, discovered by security researchers from vpnMentor, belonged to X Social Media, an ad company that runs Facebook and Instagram advertising campaigns for the legal industry. Data contained in these forms usually included full names, email addresses, home addresses, phone numbers, and details related to their cases - mostly focused on medical injuries. ""The injuries described in the database vary from combat injuries suffered by American veterans to injuries caused by medical devices, pesticide use, medication side-effects, and defective baby products,"" the vpnMentor said in a report published this week. The details about combat injuries not only included information such as the date and place where the injury occurred, but also detailed medical information and mental trauma the person suffered in the aftermath; details that many applications wouldn't want made public. On top of this highly sensitive information relating to various injuries and legal cases, the X Social Media database also contained information about all the company's clients, ad campaign metrics, and even all the company's invoices. The ad agency closed access to its database on June 11, nine days after vpnMentor found the server and notified the company."
OWASP:A10,"Cybersecurity researchers have discovered over 80 Magecart compromised e-commerce websites that were actively sending credit card information of online shoppers to the attackers-controlled servers. Magecart is an umbrella term given to different cybercriminal groups that are specialized in secretly implanting online credit card skimmers on compromised e-commerce websites with an intent to steal payment card details of their customers. These virtual credit card skimmers, also known as formjacking attack, are basically JavaScript code that hackers secretly insert into a compromised website, often on the shopping cart page, designed to capture payment information of customers in real-time and send it to a remote attacker-controlled server. The newly disclosed campaign doesn't belong to a single group of Magecart hackers; instead, researchers used a source code search engine to search for obfuscated JavaScript on the Internet with malicious patterns that were previously seen in the Magecart's virtual credit card skimmers. According to the researchers, the technique allowed them to quickly uncover more than 80 e-commerce websites compromised by Magecart groups, most of which were found running over outdated versions of Magento CMS that's vulnerable to an unauthenticated upload and remote code execution vulnerabilities. ""Many of the compromised sites are running version 1.5, 1.7, or 1.9. The arbitrary file upload, remote code execution, and cross-site request forgery vulnerabilities all affect Magento version 2.1.6 and below. While it can't be stated authoritatively that this is what led to the breach of these sites, these are vulnerable versions of Magento that allow adversaries to inject the formjacking code into the site."" Though the researchers have not named the compromised companies in its report, they worked with federal law enforcement to notify all affected organizations as well as off-site servers prior to publishing their report. ""To recruit merchandise mules, the attacker posts jobs that offer people the ability to work from home and earn large sums of money to receive and reship merchandise purchased with the stolen credit card numbers,"" the researchers say."
OWASP:A9,"XKCD-one of the most popular webcomic platforms known for its geeky tech humor and other science-laden comic strips on romance, sarcasm, math, and language-has suffered a data breach exposing data of its forum users. At the time of writing, XKCD has taken down its forum and posted a short notice on its homepage, as shared below, urging its users to change their passwords immediately. ""The xkcd forums are currently offline. We've been alerted that portions of the PHPBB user table from our forums showed up in a leaked data collection. The data includes usernames, email addresses, salted, hashed passwords, and in some cases, an IP address from the time of registration."" ""We've taken the forums offline until we can go over them and make sure they're secure. If you're an echochamber.me/xkcd forums user, you should immediately change your password for any other accounts on which you used the same or a similar password."" The forum administrators are also notifying affected users via email. As mentioned, XKCD uses phpBB, a free and open-source forum and bulletin board software built in the PHP programming software. At this moment it's unclear if XKCD was using an older version of the forum software vulnerable to a security flaw or the attackers exploited any previously undiscovered flaw in phpBB to extract the data unauthorisedly. Even if XKCD was running over phpBB version 3.1 and later, which uses more secure BCRYPT hashing algorithm, it's possible that the passwords for early users of the XKCD forum were encrypted via the older, less secure MD5 hashing method. What you can do now: affected users are strongly advised to immediately change their XKCD password, as well as passwords for any other online accounts which re-use the same password."
