Tag,Data
OWASP:A10,"Live Nation Entertainment subsidiary Ticketmaster has admitted it has suffered a serious data breach affecting 40,000 of its British and international customers. Anyone who used the Ticketmaster UK, GETMEIN! and TicketWeb sites to book tickets from February 2018 and 23 June 2018 may have had data compromised, including their name, email address, physical address, telephone number, Ticketmaster logins, and payment card details. On Thursday 12th April , members of the Ticketmaster security team visited the Monzo office so we could share the information we'd gathered. On Saturday, June 23, 2018, Ticketmaster UK identified malicious software on a customer support product hosted by Inbenta Technologies, an external third-party supplier to Ticketmaster. Ticketmaster may end up with questions from the UK Information Commissioner's Office about the apparent delay in telling its customers. What to do? If you're one of the 40,000 account holders that Ticketmaster says was affected by the compromise, you should have received an email telling you to change your account password. Replace your payment cards as soon as you can if you're on the list of Ticketmaster customers known to have been affected."
ATT&CK:T1078,THE PAGE IS IN AN UNRECOGNISABLE FORMAT
OWASP:A5,"U.S. Postal Service just fixed a security weakness that allowed anyone who has an account at usps.com to view account details for some 60 million other users, and in some cases to modify account details on their behalf. In addition to exposing near real-time data about packages and mail being sent by USPS commercial customers, the flaw let any logged-in usps.com user query the system for account details belonging to any other users, such as email address, username, user ID, account number, street address, phone number, authorized users, mailing campaign data and other information. In cases where multiple accounts shared a common data element - such as a street address - using the API to search for one specific data element often brought up multiple records. ""It seems like the only access control they had in place was that you were logged in at all. And if you can access other peoples' data because they aren't enforcing access controls on reading that data, it's catastrophically bad and I'm willing to bet they're not enforcing controls on writing to that data as well."" The USPS appears to have included a validation step to prevent unauthorized changes - at least with some data fields. It does not appear USPS account passwords were exposed via this API, although KrebsOnSecurity conducted only a very brief and limited review of the API's rather broad functionality before reporting the issue to the USPS. The API at issue resides here; a copy of the API prior to its modification on Nov. 20 by the USPS is available here as a text file. The USPS told the OIG it had addressed the authentication problems raised in the audit report, which appear to have been related to how data was encrypted in transit."
OWASP:A10,"Vision Direct has admitted customers' personal and financial data was leaked earlier this month after hackers compromised the company's website. The breach took place between 00:11 GMT on 3 November and 12:52 GMT on 8 November, said Vision Direct, which purports to be Europe's largest etailer of contact lenses and eye care products and services. Customers who logged in during those times to update their accounts, or anyone creating a new account will have been affected and their data exposed, the company confirmed. Vision Direct said that given the nature of the breach, no data previously stored in its database had been affected by the hack. It claimed the breach had been ""Resolved"" and the website was again running normally. Customers with concerns can call the customer services team on 020 7768 5000 from the UK and 1 800 870 0741 from the US. El Reg is already aware of one report of a Vision Direct customer who claimed to have received notification from their bank of multiple transactions of just under £250 made to companies that they'd never heard of. Helms encouraged security folk to follow some advice given by NCSC following attacks earlier in the year when UK government websites were struck with cryptojacking attacks, where the miscreants mined Monero rather than pilfering credit card info."
OWASP:A5,"The server wasn't protected with a password, allowing anyone who knew where to look to peek in and snoop on a near-real-time stream of text messages. Worse, the database - running on Amazon's Elasticsearch - was configured with a Kibana front-end, making the data within easily readable, browsable and searchable for names, cell numbers and the contents of the text messages themselves. It's firms like Voxox that act as a gateway and converting those codes into text messages, to be passed on to the cell networks for delivery to the user's phone. At the time of its closure, the database appeared to have a little over 26 million text messages year-to-date. Many messages included two-factor verification codes for Google accounts in Latin America;. We also found messages that contained Microsoft's account password reset codes and Huawei ID verification codes;. With access to the text message through the exposed database, hijacking an account could take seconds."
OWASP:A5,"The past few days have showered plenty of favorable attention on a new trading platform called DX.Exchange, with glowing profiles by Bloomberg News and CNBC. The only problem is that the site, which allows people to trade currencies and digitized versions of Apple, Tesla, and other stocks, has been leaking oodles of account login credentials and personal user information. Besides spilling user data and allowing unauthorized access to user accounts, the leak puts the entire security of the site in serious jeopardy because some of the leaked tokens appear to belong to employees of the site. In the event that such a token gave unauthorized access to an account with administrative privileges, the hacker might be able to download entire databases, seed the site with malware, and possibly even transfer funds out of user accounts. Ars sent emails to users of eight randomly chosen tokens to ask if they had accounts on the site. A few hours later, officials announced a site maintenance update, but even after the site came back online, the leak continued. The favorable attention showered on DX.Exchange is unfortunate, because it detracts attention from several security weaknesses that should serve as warning signs that the site may not be adequately safeguarding the tremendous amount of sensitive data it requires users to provide. Best practices call for authentication tokens to be time stamped and then signed with a private encryption key each time a user sends it to a site."
OWASP:A5,"An investigation is underway into a booking software vulnerability that exposed airline passenger name records, which is a bundle of personal and travel data that gets collected whenever someone books a flight. El Al uses a booking system from Amadeus, a Madrid-based company based that works with 500 airlines, including United Airlines and Air Canada. Airlines typically issue a six-digit alphanumeric booking reference code whenever someone books their ticket. El Al sends customers a link to a web page to check their PNR. But Rotem discovered that he could insert a random booking reference number into the link. With that information in hand, it's possible to access someone else's booking information using the booking reference number and the last name of a passenger. Global distribution systems, such as the one run by Amadeus and other booking software providers, including Sabre and Travelport, date back decades. ""The way 6-digit booking codes are chosen makes them weaker than a 5-digit password ("". In the short term, Nohl and Nikodijevic recommended airlines employ Captchas and also limit the number of requests per IP address."
BEC:Impersonation,"In a case of business email compromise, Chinese hackers stole $18.6 million from the Indian arm of Tecnimont SpA, an Italian engineering company, through an elaborate cyber fraud scheme that included impersonating the firm's chief executive, the Economic Times reports. The scammers sent emails requesting funds to the India head of Tecnimont, part of the publicly traded Maire Tecnimont, from an account that looked deceptively similar to one used by the Italian group's CEO, and also organized conference calls to discuss a ""Confidential"" acquisition in China, the ET report said. Defending against sophisticated BEC scams can be more difficult than spotting a phishing email, security experts note. According to the report in Economic Times, after sending emails to head of Indian subsidiary of the Milan-headquartered firm, hackers then arranged a series of conference calls to discuss a confidential acquisition in China. Tools such as DMARC, Domain Message Authentication Reporting and Conformance, and SPF, Sender Policy Framework, only work when emails are sent from the same domain name. ""DMARC is a lot about business email compromise, spoofing of email etc, but it works only if hackers are spoofing on your domain. In such cases, SPF policies and DMARC will work and stop you from getting conned,"" says Shomiron Das Gupta, founder and CEO at Netmonastery, a SIEM security and event log management firm. In BEC attacks, the fake message often comes from a legitimate email account that an attacker has gained access to, either through social engineering or a targeted compromise."
ATT&CK:T1078,"Although Aimbridge Hospitality Holdings, LLC is unaware of any actual or attempted misuse of the personal information, they notified the affected individuals in an abundance of caution because their information was present in the impacted email accounts. Aimbridge Hospitality Holdings, LLC is also providing individuals with information on how to place a fraud alert and security freeze on one's credit file, information on protecting against tax fraud, the contact details for the national consumer reporting agencies, information on how to obtain a free credit report, a reminder to remain vigilant for incidents of fraud and identity theft by reviewing account statements and monitoring free credit reports, and encouragement to contact the Federal Trade Commission, their state Attorney General, and law enforcement to report attempted or actual identity theft and fraud. We are providing you with information regarding the incident, steps we have taken since discovering the incident, and what you can do to protect your personal information should you feel it is appropriate to do so. Although we are unaware of any actual or attempted misuse of your personal information, we are notifying you in an abundance of caution because your information was present in the impacted email accounts. For New Mexico residents, you have rights pursuant to the Fair Credit Reporting Act, such as the right to be told if information in your credit file has been used against you, the right to know what is in your credit file, the right to ask for your credit score, and the right to dispute incomplete or inaccurate information. Further, pursuant to the Fair Credit Reporting Act, the consumer reporting agencies must correct or delete inaccurate, incomplete, or unverifiable information; consumer reporting agencies may not report outdated negative information; access to your file is limited; you must give your consent for credit reports to be provided to employers; you may limit ""Prescreened"" offers of credit and insurance you get based on information in your credit report; and you may seek damages from violator. Although we are still unaware of any actual or attempted misuse of your personal information, we are notifying you again in an abundance of caution because your information was present in the recently impacted email accounts."
OWASP:A10,"The information did not include your Social Security Number, driver's license number, state identification number, health information, or any other financial information. What You Can Do Again, we take very seriously the security and privacy of your information, and want to make sure you have the information you need so that you can take steps to help protect your personal information. At the end of this letter, we have provided you with additional information regarding steps you can take to further protect yourself and your information. You may want to contact the three U.S. credit reporting agencies to report the incident and request a credit report: Equifax P.O. Box 740241 Atlanta, GA 30374 349-5191 www. Transunion.com Credit Report: You can request a free credit report once a year at www. As a result, using a security freeze may interfere with or delay your ability to apply for a new credit card, loan, wireless phone, or any service that requires a credit check. You must separately place a security freeze on your credit file with each credit reporting agency."
ATT&CK:T1078,"We are providing you with steps you can take to protect your personal information and offering you twelve months of credit and identity monitoring services at no cost through TransUnion Interactive, a leader in risk mitigation and response. These services include unlimited access to your TransUnion credit report and credit score. To receive these services, you must be over the age of 18, have established credit in the United States, have a Social Security number in your name, and have a U.S. residential address associated with your credit file. Sincerely, Eric Jensen, President Jensen Enterprises, Inc. W7312 v.02 01.08.2019 STEPS YOU CAN TAKE TO FURTHER PROTECT YOUR INFORMATION Review Your Account Statements and Notify Law Enforcement of Suspicious Activity: As a precautionary measure, we recommend that you remain vigilant by reviewing your account statements and credit reports closely. To place a fraud alert on your credit report, contact any of the three credit reporting agencies identified above. You must separately place a security freeze on your credit file with each credit reporting agency. Gov 401-274-4400 You also have certain rights under the Fair Credit Reporting Act, including the right to know what is in your file, to dispute incomplete or inaccurate information, and to have consumer reporting agencies correct or delete inaccurate, incomplete, or unverifiable information."
OWASP:A10,"What Happened? On or around October 8, 2018, E-Z UP was notified by its credit card processor of suspicious activity related to certain credit cards used in transactions on its website. Under U.S. law you are entitled to one free credit report annually from each of the three major credit reporting bureaus. You have the right to place a ""Security freeze"" on your credit report, which will prohibit a consumer reporting agency from releasing information in your credit report without your express authorization. You should be aware that using a security freeze to take control over who gets access to the personal and financial information in your credit report may delay, interfere with, or prohibit the timely approval of any subsequent request or application you make regarding a new loan, credit, mortgage, or any other account involving the extension of credit. Upon seeing a fraud alert display on a consumer's credit file, a business is required to take steps to verify the consumer's identity before extending new credit. For New Mexico residents, you have rights pursuant to the Fair Credit Reporting Act, such as the right to be told if information in your credit file has been used against you, the right to know what is in your credit file, the right to ask for your credit score, and the right to dispute incomplete or inaccurate information. Further, pursuant to the Fair Credit Reporting Act, the consumer reporting agencies must correct or delete inaccurate, incomplete, or unverifiable information; consumer reporting agencies may not report outdated negative information; access to your file is limited; you must give your consent for credit reports to be provided to employers; you may limit ""Prescreened"" offers of credit and insurance you get based on information in your credit report; and you may seek damages from violator."
OWASP:A1,"Cybersecurity company Comodo has become one of the major victims of a recently disclosed vBulletin 0-day vulnerability, exposing login account information of over nearly 245,000 users registered with the Comodo Forums websites. In a brief security notice published earlier today, Comodo admitted the data breach, revealing that an unknown attacker exploited the vBulletin vulnerability and potentially gained access to Comodo Forums database. Comodo has not specified which of the company's forums has been hacked out of the two separate forums it owns. The company became aware of the security breach over the weekend on September 29 morning, which suggests users registered on Comodo Forums until this Sunday are impacted by the breach. ""Over the weekend at 4:57 am ET on Sunday, September 29, 2019, we became aware that this security flaw in the vBulletin software had become exploited resulting in a potential data breach on the Comodo Forums."" Immediately after detecting the security intrusion, the Comodo IT infrastructure team immediately took the forums offline in an attempt to mitigate the vBulletin exploit and applied the recommended security patches. What Users Should Do Now? If you have registered with Comodo Forums on or before September 29, you are highly recommended to immediately change the password for your forum account to a strong and unique one and for any other online account where you use the same credentials. Although the account passwords were hashed in vBulletin for the Comodo Forum users, Comodo advises users to change their passwords as part of good password practices."
OWASP:A1,"LONDON - A recent attack aimed at a U.S.-based oil, gas and chemical supplier leverages the company's use of the enterprise-class Asterisk open-source PBX software, used for VoIP services. According to research from Check Point, presented here at Virus Bulletin 2019 on Friday, the attack was first identified early last year when researchers spotted scanning activity targeting 1,500 unique gateways tied to 600 companies. As a result, the adversary was able to gain complete control over the server, including being able to access databases, call recordings, metadata and detailed information on who called whom and when within the organization. The attacker injected a call file that caused the Asterisk server to make external calls and play canned messages with the identity of the victimized company. The PHP code hooked up with a command-and-control server, and downloaded a password-protected PHP web shell that carried out the data extraction, including the CALL file, which contains metadata on the calls made by the server. The attacker inserted a new CALL file into the outgoing directory, offering the ability to make outgoing calls under the guise of the victimized company. ""The infection vector is a customized PHP web shell, which is weaponized with new techniques targeting the Asterisk internal configuration files and databases - the same databases that hold all of the calls' metadata as well as the recordings of the calls,"" according to the paper."
OWASP:A10,"Hackers caused havoc at four restaurant chains in the U.S. over the summer after compromising their payment systems with malware that stole customers' payment card information. In the last two days, McAlister's Deli, Moe's Southwest Grill, Schlotzsky's, and Hy-Vee disclosed publicly that their networks were infected with point-of-sale malware copying data from cards used in person at certain locations. Yesterday, the three Focus Brands subsidiaries provided details about a payment card security incident affecting corporate and franchised restaurants. As payment card data passed through a restaurant's server, the PoS malware copied from the card's magnetic stripe the card number, expiration date, and internal verification code; the cardholder's name was also available in some cases. Today's notification from Hy-Vee is an update for communication released on August 14 that informed customers of a payment data card incident discovered at an earlier date. In six locations there are suspicions that the start date for sweeping the card data was November 9, 2018. While PoS malware activity is far from its glory days, it continues to be good business as cards can sell for up to $35, depending on the brand, country, and amount of details they come with."
OWASP:A10,"What Happened? On or around October 8, 2018, E-Z UP was notified by its credit card processor of suspicious activity related to certain credit cards used in transactions on its website. Under U.S. law you are entitled to one free credit report annually from each of the three major credit reporting bureaus. You have the right to place a ""Security freeze"" on your credit report, which will prohibit a consumer reporting agency from releasing information in your credit report without your express authorization. You should be aware that using a security freeze to take control over who gets access to the personal and financial information in your credit report may delay, interfere with, or prohibit the timely approval of any subsequent request or application you make regarding a new loan, credit, mortgage, or any other account involving the extension of credit. Upon seeing a fraud alert display on a consumer's credit file, a business is required to take steps to verify the consumer's identity before extending new credit. For New Mexico residents, you have rights pursuant to the Fair Credit Reporting Act, such as the right to be told if information in your credit file has been used against you, the right to know what is in your credit file, the right to ask for your credit score, and the right to dispute incomplete or inaccurate information. Further, pursuant to the Fair Credit Reporting Act, the consumer reporting agencies must correct or delete inaccurate, incomplete, or unverifiable information; consumer reporting agencies may not report outdated negative information; access to your file is limited; you must give your consent for credit reports to be provided to employers; you may limit ""Prescreened"" offers of credit and insurance you get based on information in your credit report; and you may seek damages from violator."
OWASP:A5,"The company pulled the server offline Tuesday within an hour of TechCrunch alerting the company, after the data was found by security researcher Oliver Hough. The database itself, running on a hosted Amazon Elasticsearch server, was storing tens of gigabytes of data, including customer names, contact information and case work for each corporate customer. A portion of the database was dedicated to all of the company's corporate clients, allowing its customers to interact with Rubrik staff with issues or complaints. The client database disclosed what appears to be the company's entire roster of corporate customers, including Deloitte, Shell, Amalgamated Bank, the U.K. National Health Service and Homeland Security and other federal government departments. ""While building a new solution for customer support, a sandbox environment containing a subset of our customer corporate contact information and support interaction data was potentially accessible for a brief period of time,"" said a spokesperson for Rubrik. Rubrik didn't say if it would notify its customers or state regulators, per data breach notification laws. Rubrik's data exposure came just months after data management and backup rival Veeam exposed millions of email addresses in its own data exposure."
OWASP:A5,"Veeam, a backup and data recovery company, bills itself as a data giant that among other things can ""Anticipate need and meet demand, and move securely across multi-cloud infrastructures,"" but is believed to have mislaid its own database of customer records. Security researcher Bob Diachenko found an exposed database containing more than 200 gigabytes of customer records, mostly names, email addresses, and in some cases IP addresses. Diachenko, who blogged about his latest find, the database didn't have a password and could be accessed by anyone knowing where to look. The database of more than 200 gigabytes - including two collections that had 199.1 million and 244.4 million email addresses and records respectively over a four-year period between 2013 and 2017. It's not the first time a massive database of email addresses has leaked online. An exposed database run by River City Media leaked over 393 million email addresses in 2017, which prompted a frivolous lawsuit against the security researcher who found it. Later in the year, a massive spambot of 711 million email addresses, believed to be largest ever, was uncovered last year by a Paris-based researcher."
